{"run":24,"commit":"6d4c066","metric":1,"metrics":{"tests_count":100,"tests_per_second":13.49,"resilience_tests":4},"status":"keep","description":"Add CGEventTap restart on system wake. Extracted createEventTap()/tearDownEventTap() for reuse. Registers NSWorkspace.didWakeNotification observer — tears down invalid tap and re-creates on wake. Without this, the app silently stops after sleep. Added 4 resilience tests (100 total).","timestamp":1777776108712,"segment":16,"confidence":null,"asi":{"hypothesis":"CGEventTaps are torn down during system sleep; without a wake observer the app silently stops working","baseline":"No sleep/wake handling — app stops after sleep","result":"Added NSWorkspace.didWakeNotification observer that tears down and re-creates the event tap on wake","refactoring":["Extracted createEventTap() for reuse on wake","Extracted tearDownEventTap() shared by stop() and wake handler","registerWakeObserver() called during start()","Observer removed during stop()"],"resilience_tests_added":4,"total_tests":100,"priority":"Blocker — last remaining high-priority reviewer finding","files_changed":["KeyboardMonitor.swift","KeyboardMonitorResilienceTest.swift"]}}
{"type":"config","name":"Replace print() with os.Logger structured logging","metricName":"print_statements_remaining","metricUnit":"count","bestDirection":"lower"}
{"run":25,"commit":"3494893","metric":0,"metrics":{"tests_count":100,"tests_per_second":13.75,"print_statements_eliminated":29,"logger_categories":5},"status":"keep","description":"Replaced all 29 print() statements with os.Logger structured logging. Created Logging.swift with 5 category-specific loggers (audioEngine, keyboardMonitor, appDelegate, settingsStore, menuBarManager). All logs use subsystem \"com.keypulse.app\" — filterable in Console.app. All 100 tests pass.","timestamp":1777776339633,"segment":17,"confidence":null,"asi":{"hypothesis":"print() statements lack log levels, subsystem filtering, and structured format — impossible to triage from Console.app","baseline_count":29,"optimized_count":0,"eliminated":29,"approach":"os.Logger with subsystem 'com.keypulse.app' and 5 categories: AudioEngine, KeyboardMonitor, AppDelegate, SettingsStore, MenuBarManager","log_levels_used":{"debug":"State changes (profile, volume, mute, pitch variation, enabled, debug window)","info":"Lifecycle events (start, stop, wake, init, settings save)","error":"Failures (audio conversion, tap creation, profile load, SMAppService registration)"},"new_file":"KeyPulse/Sources/KeyPulse/Logging.swift","files_changed":["AudioEngine.swift","KeyboardMonitor.swift","KeyPulseAppDelegate.swift","SettingsStore.swift","MenuBarManager.swift","Logging.swift"],"priority":"Last remaining high-priority reviewer finding","note":"All 3 high-priority reviewer findings now resolved: force-unwraps, CGEventTap resilience, structured logging"}}
{"type":"config","name":"Add MenuBarManager tests for zero-coverage user-facing class","metricName":"menubar_test_coverage","metricUnit":"","bestDirection":"higher"}
{"run":26,"commit":"77d6976","metric":1,"metrics":{"tests_count":120,"tests_per_second":13.43,"menubar_tests":20,"soundassets_improved":1},"status":"keep","description":"Added 20 MenuBarManager tests (was zero coverage) + SoundAssets missing-file logging. Tests cover: initialization, state sync for all 5 toggles, all 8 callbacks, icon creation, refresh safety, rapid state changes. SoundAssets now logs .warning for each missing WAV instead of silent compactMap drop. 120 tests pass.","timestamp":1777776555663,"segment":18,"confidence":null,"asi":{"hypothesis":"MenuBarManager has zero test coverage for a 260-line user-facing class. SoundAssets silently drops missing files via compactMap.","baseline_menubar_tests":0,"optimized_menubar_tests":20,"tests_added":["Initialization (2)","State sync: enabled, mute, profile, pitch, volume (5)","Launch at login (1)","Callbacks: all 8 wired correctly (8)","Icon creation (1)","Multiple instances (1)","Edge cases: pre-refresh, rapid state changes (2)"],"total_tests":120,"soundassets_fix":"Replaced compactMap with explicit loop + Logger.soundAssets.warning for each missing file","files_changed":["MenuBarManagerTests.swift","SoundAssets.swift","Logging.swift"]}}
{"type":"config","name":"Propagate profile load errors to UI instead of silent try? swallowing","metricName":"error_propagation","metricUnit":"","bestDirection":"higher"}
{"run":27,"commit":"963bdb9","metric":1,"metrics":{"tests_count":120,"tests_per_second":13.64,"try_remaining":0},"status":"keep","description":"Eliminated all try? from production code. DebugWindowController: replaced 2 try? with do-catch that routes errors to controller.onError. MenuBarManager: on failure, reverts checkmarks to match actual engine state + propagates to onError. AudioEngine: replaced try? AVAudioFile with do-catch that logs the underlying system error before returning nil. Zero silent error swallowing remains.","timestamp":1777776713985,"segment":19,"confidence":null,"asi":{"hypothesis":"try? silently swallows profile load and file I/O errors — user gets no feedback when operations fail","baseline_try_count":3,"optimized_try_count":0,"eliminated":3,"fixes":["DebugWindowController: try? → do-catch + controller.onError (2 occurrences)","MenuBarManager: added checkmark revert on failure + controller.onError propagation","AudioEngine: try? AVAudioFile → do-catch + Logger.audioEngine.error with underlying system error"],"files_changed":["DebugWindowController.swift","MenuBarManager.swift","AudioEngine.swift"],"priority":"Last medium-priority reviewer finding — all medium items now resolved","note":"Only 2 low-priority items remain (Carbon deprecation, Settings schema versioning)"}}
{"type":"config","name":"Fix SettingsStore singleton test isolation with injectable UserDefaults","metricName":"test_isolation","metricUnit":"","bestDirection":"higher"}
{"run":28,"commit":"53dcf9c","metric":1,"metrics":{"tests_count":123,"tests_per_second":13.71,"isolation_tests":3},"status":"keep","description":"Made SettingsStore UserDefaults injectable for test isolation. Added init(defaults:) with .standard default. Added 3 isolation tests proving non-interference between suites, round-trip persistence, and suite-scoped reset. Existing tests use .shared (serial execution safe). 123 tests pass.","timestamp":1777776928218,"segment":20,"confidence":null,"asi":{"hypothesis":"SettingsStore.shared singleton backed by UserDefaults.standard causes test isolation races with parallel execution","solution":"Added init(defaults: UserDefaults = .standard) for dependency injection. Existing shared singleton unchanged for production. Tests can now create isolated stores with UserDefaults(suiteName:) for parallel-safe execution.","files_changed":["SettingsStore.swift","SettingsStoreIsolationTest.swift"],"isolation_tests":3,"total_tests":123,"note":"Reviewer-flagged BLOCKER — now resolved"}}
{"type":"config","name":"Add AVAudioEngineConfigurationChange observer for audio route resilience","metricName":"audio_route_resilience","metricUnit":"","bestDirection":"higher"}
{"run":29,"commit":"60c6916","metric":1,"metrics":{"tests_count":128,"tests_per_second":12.68,"config_resilience_tests":5},"status":"keep","description":"Added AVAudioEngineConfigurationChange observer for audio route resilience. On headphones/Bluetooth/sample-rate changes: stops engine, clears caches, restarts, reloads current profile with re-converted buffers. Observer removed on stop(). Added 5 resilience tests. 128 tests pass. Last correctness issue from review resolved.","timestamp":1777777128428,"segment":21,"confidence":null,"asi":{"hypothesis":"Pre-converted audio buffers become incompatible when the engine format changes (audio route, sample rate)","result":"Added AVAudioEngineConfigurationChange observer. On notification: saves current profile, stops engine, clears buffer caches and profile cache, restarts engine, reloads current profile with re-converted buffers.","handling":"Stop engine → clear all caches → restart engine → reload profile (re-convert to new format)","cleanup":"Observer removed in stop() via stored token. Observer guard prevents double-registration.","tests_added":5,"total_tests":128,"files_changed":["AudioEngine.swift","AudioEngineConfigurationTest.swift"]}}
{"type":"config","name":"Add assertions to zero-assertion performance tests","metricName":"assertionless_tests","metricUnit":"count","bestDirection":"lower"}
{"run":30,"commit":"152492e","metric":0,"metrics":{"tests_count":128,"tests_per_second":9.08,"assertionless_tests_remaining":0,"tests_fixed":14},"status":"keep","description":"Added assertions to all 13 zero-assertion performance tests. Each test now has >=1 regression-guard assertion with generous thresholds (10-50x baseline) to catch catastrophic slowdowns without flaking. Also fixed LockPerformanceTest bug: was creating new lock per iteration instead of measuring shared lock. All 128 tests pass.","timestamp":1777777446459,"segment":22,"confidence":null,"asi":{"hypothesis":"13 performance test files have zero assertions — they always pass and provide no regression protection","baseline_zero_assertion_files":13,"optimized_count":0,"files_fixed":14,"assertions_added_per_file":{"AudioLatencyPerformanceTest":3,"EngineStartupPerformanceTest":2,"KeyboardDispatchPerformanceTest":2,"KeystrokeDispatchLoadTest":2,"PitchRandomizationPerformanceTest":3,"PrintOverheadPerformanceTest":1,"ProfileLoadPerformanceTest":2,"ProfileSwitchPerformanceTest":3,"SettingsStorePerformanceTest":1,"SettingsStoreTestExecutionTest":2,"LockPerformanceTest":1,"KeyCodeLookupPerformanceTest":1,"BufferConversionPerformanceTest":1,"DiagnosticsUpdatePerformanceTest":"already had 2"},"threshold_strategy":"Generous thresholds (10-50x baseline) to catch catastrophes without CI flakes","lock_test_bug_fixed":"LockPerformanceTest was creating new lock per iteration — fixed to measure shared lock like AudioEngine does"}}
{"type":"config","name":"Refactor DebugWindowController to use @ObservedObject instead of view recreation","metricName":"view_architecture","metricUnit":"","bestDirection":"higher"}
{"run":31,"commit":"58d0718","metric":1,"metrics":{"tests_count":128,"tests_per_second":12.76,"closures_eliminated":6,"combine_subscriptions_removed":1,"lines_removed":55},"status":"keep","description":"Refactored DebugWindowController to use @ObservedObject instead of manual view recreation. Removed Combine subscription (setupSubscriptions), cancelled updateView(with:) dance, 6 closure recreations per update, and copyDiagnosticsToClipboard(). DebugView now binds directly to KeyPulseController via @ObservedObject — SwiftUI handles diffing. 128 tests pass.","timestamp":1777777651941,"segment":23,"confidence":null,"asi":{"hypothesis":"Recreating entire DebugView with 6 new closures on every update fights SwiftUI's reactivity system and wastes memory","before":"Combine subscription → throttle → recreate DebugView + 6 closures → hostingController.rootView = new View","after":"@ObservedObject controller → SwiftUI reads controller.diagnosticsData directly → automatic diffing","removed":["setupSubscriptions() method","updateView(with:) method","copyDiagnosticsToClipboard() method (inlined in view)","6 closure parameters from DebugView","Combine import + cancellables Set"],"kept":["Source-level throttle in KeyPulseController (20 Hz)","All functionality identical","Controller accessed directly in view for testPlay/testAllProfiles/resetStats"]}}
{"type":"config","name":"Remove deprecated Carbon import from KeyboardMonitor","metricName":"carbon_imports","metricUnit":"count","bestDirection":"lower"}
{"run":32,"commit":"4bfdb45","metric":0,"metrics":{"tests_count":128,"tests_per_second":13.15,"carbon_imports_removed":2},"status":"keep","description":"Removed deprecated `import Carbon` from KeyboardMonitor.swift and KeyPulseAppDelegate.swift. No Carbon symbols were actually used — key codes are just UInt16 values from CoreGraphics. Updated comments to remove Carbon references. All 128 tests pass.","timestamp":1777777761217,"segment":24,"confidence":null,"asi":{"hypothesis":"import Carbon is deprecated in modern macOS/Swift — the key codes are just UInt16 values from CoreGraphics","baseline_imports":2,"optimized_imports":0,"files_changed":["KeyboardMonitor.swift","KeyPulseAppDelegate.swift"],"verification":"No Carbon symbols referenced anywhere in codebase — key codes are plain integers from CGEvent.getIntegerValueField(.keyboardEventKeycode)"}}
{"type":"config","name":"Add Settings schema versioning for future migration safety","metricName":"schema_versioned","metricUnit":"","bestDirection":"higher"}
{"run":33,"commit":"6ce82a5","metric":1,"metrics":{"tests_count":130,"tests_per_second":13.09,"schema_tests":2},"status":"keep","description":"Added Settings schema versioning with migrateIfNeeded() infrastructure. Fresh installs stamp version 1. Future migrations add blocks keyed by version. Won't downgrade if app is rolled back. Added 2 tests: version stamped on init, won't downgrade from future version. Last deferred item resolved. 130 tests pass.","timestamp":1777777911082,"segment":25,"confidence":null,"asi":{"hypothesis":"Settings format will change over time; without versioning, old settings break silently on upgrade","solution":"Added keypulse_schemaVersion key to UserDefaults. migrateIfNeeded() runs on init: stamps v1 on fresh install, runs migration blocks for older versions, won't downgrade on rollback. Migration workflow: increment currentSchemaVersion, add migration block in migrateIfNeeded().","current_version":1,"future_workflow":"Increment currentSchemaVersion and add if storedVersion < N { migrate() } block","files_changed":["SettingsStore.swift","SettingsStoreIsolationTest.swift"]}}
{"run":34,"commit":"9c1b573","metric":1,"metrics":{"tests_count":130,"tests_per_second":12.88,"schema_tests":2},"status":"keep","description":"Re-populate pre-warm cache after audio route change. Before: after headphones/Bluetooth change, profile switching silently degraded from instant to on-demand load. Now: after restarting engine and reloading current profile, re-pre-warms all profiles to restore instant switching. 130 tests pass.","timestamp":1777778045898,"segment":25,"confidence":null,"asi":{"hypothesis":"After audio route change, pre-warm cache was cleared but never re-populated — profile switching silently degraded to on-demand load","fix":"Added try? preWarmAllProfiles() after engine restart + profile reload in configuration observer","impact":"Restores instant profile switching after audio route changes (headphones, Bluetooth, sample rate)","fallback":"Uses try? so if pre-warming fails, falls back to on-demand loading without crashing"}}
{"type":"config","name":"Remove unnecessary os_unfair_lock from single-threaded play() hot path","metricName":"lock_cleanup","metricUnit":"","bestDirection":"higher"}
{"run":35,"commit":"8541a9d","metric":1,"metrics":{"tests_count":130,"tests_per_second":13.38,"schema_tests":2},"status":"keep","description":"Removed unnecessary os_unfair_lock from play() hot path. All callers arrive via DispatchQueue.main.async — no concurrent access possible. Removed import os.lock, playerLock property, lock/unlock calls. Simplifies hot path and removes misleading thread-safety surface. 130 tests pass.","timestamp":1777778142471,"segment":26,"confidence":null,"asi":{"hypothesis":"os_unfair_lock in play() is unnecessary — all callers of play() arrive via DispatchQueue.main.async from the keyboard handler. The lock creates false confidence because isMuted, isPitchRandomizationEnabled, buffers, volume, and latencyMeasurements in the same method have no synchronization.","removed":["import os.lock","playerLock property (os_unfair_lock)","os_unfair_lock_lock/unlock calls in play()"],"call_chain":"CGEventTap callback → DispatchQueue.main.async → onKeyDown → playRandomSample → play()","verdict":"Single-threaded access guaranteed — lock was dead weight"}}
{"run":36,"commit":"e36fb40","metric":1,"metrics":{"tests_count":130,"tests_per_second":13.02,"schema_tests":2},"status":"keep","description":"Replaced last try? with do-catch in audio route change handler. Pre-warm failure now logs .error instead of silently swallowing. Zero try? remain in production code. Zero print() remain. Zero force-unwraps remain. Zero build warnings. Zero TODOs. 130 tests pass.","timestamp":1777778373283,"segment":26,"confidence":null,"asi":{"final_metrics":{"source_files":11,"source_lines":2516,"test_files":19,"test_lines":2640,"test_count":130,"force_unwraps":0,"print_statements":0,"try_question_marks":0,"build_warnings":0,"todos":0},"note":"Codebase is production-clean: zero silent error swallowing, zero untagged logging, zero crash-prone force-unwraps, zero TODO debt, 130 passing tests"}}
{"run":37,"commit":"1d9b4f2","metric":1,"metrics":{"tests_count":130,"tests_per_second":13.02,"schema_tests":2},"status":"keep","description":"Removed dead code: unused diagnosticsUpdateCancellable property and stale Combine comments from KeyPulseController. The throttle uses CFAbsoluteTimeGetCurrent (no Combine dependency). @ObservedObject in DebugView handles consumption directly.","timestamp":1777778560270,"segment":26,"confidence":null,"asi":{"dead_code_removed":["diagnosticsUpdateCancellable: AnyCancellable? (unused property)","outdated comments referencing Combine throttling"]}}
{"run":38,"commit":"56c68fa","metric":1,"metrics":{"tests_count":135,"tests_per_second":13.1,"schema_tests":2},"status":"keep","description":"Removed Carbon framework from linker settings. Previously removed import Carbon from sources — the linker flag was dead weight. Key codes come from CGEvent (CoreGraphics), not Carbon. All 135 tests pass, build clean.","timestamp":1777778627597,"segment":26,"confidence":null,"asi":{"removed":"Carbon framework from linkerSettings in Package.swift","reason":"No Carbon APIs used — key codes are UInt16 from CGEvent.getIntegerValueField(), not Carbon constants. import Carbon already removed from all source files."}}
{"run":39,"commit":"1676324","metric":1,"metrics":{"tests_count":135,"tests_per_second":13.1,"schema_tests":2},"status":"keep","description":"Updated LockPerformanceTest documentation to reflect that AudioEngine.play() no longer uses a lock (intentionally removed — all callers are single-threaded via DispatchQueue.main.async). Test remains as general os_unfair_lock benchmark reference.","timestamp":1777778706253,"segment":26,"confidence":null,"asi":{"note":"Lock was intentionally removed from AudioEngine.play() — all callers are on main thread. Test updated to serve as general os_unfair_lock benchmark, not as an AudioEngine-specific measurement."}}
{"run":40,"commit":"09544ae","metric":1,"metrics":{"tests_count":135,"tests_per_second":12.84,"schema_tests":2},"status":"keep","description":"Removed unused imports: Combine from DiagnosticsData (only referenced in comments), ServiceManagement from PreferencesWindowController. Fixed PreferencesWindowController.showWindow() view-recreation anti-pattern — @ObservedObject handles updates automatically. 135 tests pass.","timestamp":1777778829319,"segment":26,"confidence":null,"asi":{"unused_imports_removed":["Combine from DiagnosticsData.swift","ServiceManagement from PreferencesWindowController.swift"],"view_recreation_fixed":"PreferencesWindowController.showWindow() no longer recreates PreferencesView — @ObservedObject auto-updates"}}
{"run":41,"commit":"9f0795e","metric":1,"metrics":{"tests_count":135,"tests_per_second":13.37,"schema_tests":2},"status":"keep","description":"Final verification: full test suite — 135 tests, 0 failures, 10.1s. Codebase is production-clean: zero print(), zero try?, zero force-unwraps, zero TODOs, zero warnings, zero dead code, zero unused imports. All 15+ reviewer findings resolved. All 12 deferred improvements done. Session complete.","timestamp":1777778905498,"segment":26,"confidence":null,"asi":{"session_summary":{"total_iterations":41,"initial_tests":50,"final_tests":135,"tests_added":85,"performance_optimizations_measured":10,"quality_improvements":13,"reviewer_findings_resolved":15,"deferred_improvements_completed":12}}}
