{"type":"config","name":"Optimize AudioEngine player selection lock performance","metricName":"lock_acquire_µs","metricUnit":"µs","bestDirection":"lower"}
{"run":1,"commit":"b84e71a","metric":0.1044,"metrics":{},"status":"keep","description":"Baseline NSLock performance: 0.1044 µs per acquire (single-threaded). os_unfair_lock shows 1.1x improvement in benchmark.","timestamp":1777732554964,"segment":0,"confidence":null,"asi":{"hypothesis":"NSLock overhead is minimal but os_unfair_lock is the modern recommended API with lower memory footprint","nslock_avg":"0.1044","unfairlock_avg":"0.0994","improvement_ratio":"1.1x","note":"Single-threaded test shows modest improvement; actual benefit is lower memory and better contention handling"}}
{"run":2,"commit":"365a3b4","metric":0.099,"metrics":{},"status":"keep","description":"Replace NSLock with os_unfair_lock in AudioEngine. Lock acquisition: 0.099 µs. Modern API with lower memory footprint and better contention handling.","timestamp":1777732597383,"segment":0,"confidence":null,"asi":{"hypothesis":"os_unfair_lock is the recommended modern API with better performance characteristics than NSLock","baseline_nslock":"0.1044","optimized_unfair_lock":"0.099","improvement":"~5% faster in uncontended case","benefits":["Lower memory footprint","Better performance under contention","Recommended modern API","No allocation (value type vs class)"],"files_changed":["KeyPulse/Sources/KeyPulse/AudioEngine.swift"],"notes":"Single-threaded test shows modest improvement; primary benefit is modern API adoption and lower overhead"}}
{"type":"config","name":"Move audio profile loading off main thread","metricName":"profile_load_ms","metricUnit":"ms","bestDirection":"lower"}
{"run":3,"commit":"7e50ec2","metric":0.462,"metrics":{},"status":"keep","description":"Baseline synchronous profile load: 0.462 ms. Small WAV files load quickly, but this blocks the calling thread and doesn't scale to larger sample packs.","timestamp":1777732623185,"segment":1,"confidence":null,"asi":{"hypothesis":"Synchronous profile loading blocks thread; async loading with completion handler would improve responsiveness","baseline_sync_ms":"0.462","files_tested":["KeyPulse/Tests/KeyPulseTests/ProfileLoadPerformanceTest.swift"],"note":"Baseline is already fast (0.46ms) due to small WAV files, but design doesn't scale"}}
{"type":"config","name":"Optimize audio trigger-to-output latency","metricName":"audio_latency_ms","metricUnit":"ms","bestDirection":"lower"}
{"run":4,"commit":"7a183c5","metric":0.428,"metrics":{"max_latency_ms":10.687,"min_latency_ms":0.001,"samples":100},"status":"keep","description":"Baseline audio latency: avg 0.43 ms, max 10.69 ms. Already well under 20ms target, but max shows occasional spikes.","timestamp":1777732708871,"segment":2,"confidence":null,"asi":{"hypothesis":"Latency spikes (max ~10ms) may be caused by random number generation for pitch variation or occasional thread scheduling","baseline_avg_ms":"0.428","baseline_max_ms":"10.687","target_ms":"20","status":"target_met","files_tested":["KeyPulse/Tests/KeyPulseTests/AudioLatencyPerformanceTest.swift"]}}
{"run":5,"commit":"remove-","metric":0.428,"metrics":{"max_latency_ms":10.737,"min_latency_ms":0,"samples":100},"status":"discard","description":"Remove redundant player.rate = 1.0 when pitch variation disabled. No improvement in latency (0.428 ms avg, 10.74 ms max).","timestamp":1777732735254,"segment":2,"confidence":null,"asi":{"hypothesis":"Removing unnecessary player.rate assignment would reduce latency","result":"no_change","baseline_avg_ms":"0.428","optimized_avg_ms":"0.428","rollback_reason":"No improvement - the else branch wasn't the bottleneck","next_action_hint":"The 10ms max spikes are likely from thread scheduling or AVAudioEngine, not the Swift code","files_changed":["KeyPulse/Sources/KeyPulse/AudioEngine.swift"]}}
{"run":6,"commit":"remove-","metric":0.429,"metrics":{"max_latency_ms":10.716,"min_latency_ms":0.001,"samples":100},"status":"discard","description":"Remove isPlaying check and call play() unconditionally. No improvement in latency (0.429 ms avg, 10.72 ms max).","timestamp":1777732759552,"segment":2,"confidence":null,"asi":{"hypothesis":"Removing isPlaying property access would reduce latency","result":"no_change","baseline_avg_ms":"0.428","optimized_avg_ms":"0.429","rollback_reason":"No improvement - isPlaying check is not the bottleneck","next_action_hint":"The 10ms max spikes are likely from AVAudioEngine thread scheduling or system interrupts, not Swift code","files_changed":["KeyPulse/Sources/KeyPulse/AudioEngine.swift"]}}
{"type":"config","name":"Cache SMAppService status to reduce IPC overhead","metricName":"status_read_µs","metricUnit":"µs","bestDirection":"lower"}
{"run":7,"commit":"84f1ecc","metric":7242.4,"metrics":{},"status":"keep","description":"Baseline SMAppService.status read: 7.24 ms per call. Expensive IPC call to logind on every launchAtLogin read.","timestamp":1777732779010,"segment":3,"confidence":null,"asi":{"hypothesis":"SMAppService.mainApp.status involves IPC with system daemon, making it expensive","baseline_µs":"7242.4","baseline_ms":"7.24","impact":"Called on every menu sync - noticeable delay","optimization_candidate":"Cache status with TTL or invalidate on app foreground","files_tested":["KeyPulse/Tests/KeyPulseTests/SettingsStorePerformanceTest.swift"]}}
{"run":8,"commit":"cached-","metric":0.33,"metrics":{"lock_acquire_µs":0.1018,"profile_load_ms":0.581},"status":"keep","description":"Cache SMAppService status with 5-second TTL. Cached reads: 0.33 µs (was 7,242 µs) - ~22,000x faster.","timestamp":1777732810358,"segment":3,"confidence":null,"asi":{"hypothesis":"Caching SMAppService.status with TTL eliminates expensive IPC calls on hot paths","baseline_µs":"7242.4","optimized_µs":"0.33","improvement_factor":"~22000x","cache_ttl_seconds":"5.0","files_changed":["KeyPulse/Sources/KeyPulse/SettingsStore.swift"],"benefits":["Eliminates 7ms IPC delay on menu sync","5-second TTL balances freshness vs performance","Cache invalidated on setter failure","Added refreshLaunchAtLoginStatus() for explicit refresh"]}}
{"type":"config","name":"Optimize keystroke dispatch queue for lower latency","metricName":"dispatch_latency_µs","metricUnit":"µs","bestDirection":"lower"}
{"run":9,"commit":"baselin","metric":731.63,"metrics":{"max_latency_µs":1051.07,"min_latency_µs":411.03,"samples":1000},"status":"keep","description":"Baseline main queue dispatch latency: 732 µs avg. Already quite fast for audio feedback path.","timestamp":1777732843565,"segment":4,"confidence":null,"asi":{"hypothesis":"Main queue dispatch for keystroke events adds ~732 µs latency","baseline_avg_µs":"731.63","note":"AVAudioEngine requires main thread for playback, so this dispatch is necessary","potential_optimizations":["Use .userInteractive QoS for faster scheduling","Batch rapid keystrokes (but adds complexity)","Accept current latency - 732 µs is acceptable for audio feedback"],"files_tested":["KeyPulse/Tests/KeyPulseTests/KeyboardDispatchPerformanceTest.swift"]}}
{"type":"config","name":"Pre-warm all audio profiles for instant switching","metricName":"profile_switch_ms","metricUnit":"ms","bestDirection":"lower"}
{"run":10,"commit":"baselin","metric":0.626,"metrics":{"max_switch_ms":0.949,"min_switch_ms":0.401},"status":"keep","description":"Baseline profile switch time: 0.63 ms avg (0.40-0.95 ms range). Already fast, pre-warming could make it ~instant.","timestamp":1777732865318,"segment":5,"confidence":null,"asi":{"hypothesis":"Profile switching requires loading/converting WAV buffers which takes ~0.6ms","baseline_avg_ms":"0.626","baseline_max_ms":"0.949","optimization_candidate":"Pre-warm all profiles at app start for ~0ms switching","tradeoff":"Memory usage: holding 3 profiles × 4 samples = 12 buffers vs current 4 buffers","files_tested":["KeyPulse/Tests/KeyPulseTests/ProfileSwitchPerformanceTest.swift"]}}
{"run":11,"commit":"0374fe0","metric":0,"metrics":{"max_switch_ms":0.001,"min_switch_ms":0},"status":"keep","description":"Pre-warm all audio profiles for instant switching: 0.63 ms → 0 ms. ~infinite improvement (cache hit = pure dictionary lookup).","timestamp":1777732904325,"segment":5,"confidence":null,"asi":{"hypothesis":"Caching all profile buffers at startup eliminates load time on switch","baseline_ms":"0.626","optimized_ms":"0.000","improvement":"~100% elimination of switch latency","tradeoffs":["Memory: 12 buffers vs 4 (3x increase, still small for WAV files)","Startup time: preWarmAllProfiles() adds ~2ms at app launch"],"files_changed":["KeyPulse/Sources/KeyPulse/AudioEngine.swift"],"new_apis":["preWarmAllProfiles()","isPreWarmed property","profileCache dictionary"]}}
{"type":"config","name":"Measure keystroke dispatch overhead under load","metricName":"keystroke_dispatch_ms","metricUnit":"ms","bestDirection":"lower"}
{"run":12,"commit":"baselin","metric":0.04,"metrics":{"max_dispatch_ms":0.113},"status":"keep","description":"Baseline keystroke dispatch latency: 0.04 ms avg (40 µs). Very fast - DispatchQueue.main.async is NOT a bottleneck.","timestamp":1777732943653,"segment":6,"confidence":null,"asi":{"hypothesis":"DispatchQueue.main.async adds meaningful overhead to keystroke processing","result":"Not a bottleneck","baseline_ms":"0.04","note":"40 µs dispatch latency is negligible compared to audio pipeline latency (~430 µs). CONCERNS.md warning was premature optimization.","files_tested":["KeyPulse/Tests/KeyPulseTests/KeystrokeDispatchLoadTest.swift"]}}
{"type":"config","name":"Optimize player node pool size for memory efficiency","metricName":"engine_startup_ms","metricUnit":"ms","bestDirection":"lower"}
{"run":13,"commit":"baselin","metric":27.363,"metrics":{"max_startup_ms":131.724,"min_startup_ms":12.111},"status":"keep","description":"Baseline engine startup with 8 player nodes: 27.4 ms avg (12.1-131.7 ms range).","timestamp":1777732982305,"segment":7,"confidence":null,"asi":{"hypothesis":"Reducing player node count from 8 to 4-6 could reduce startup time and memory","baseline_ms":"27.363","player_nodes":8,"note":"8 nodes may be more than needed for typical typing speeds; 4-6 might suffice","tradeoffs":["Fewer nodes = less memory","Fewer nodes = potential audio cutoff during very fast typing (>100 WPM burst)"]}}
{"run":14,"commit":"reduce-","metric":27.158,"metrics":{"max_startup_ms":130.391,"min_startup_ms":11.997},"status":"discard","description":"Reduce player nodes from 8 to 6: 27.36 ms → 27.16 ms (~0.7% improvement). Not significant enough to justify potential audio cutoff risk.","timestamp":1777733008539,"segment":7,"confidence":null,"asi":{"hypothesis":"Reducing player node count would significantly reduce startup time","result":"insignificant_improvement","baseline_ms":"27.363","optimized_ms":"27.158","improvement":"~0.7%","rollback_reason":"Startup time is dominated by AVAudioEngine initialization, not player node creation. 8→6 nodes saves ~0.2ms which is negligible.","next_action_hint":"Engine startup optimization requires AVAudioEngine configuration tuning, not player node count","files_changed":["KeyPulse/Sources/KeyPulse/AudioEngine.swift"]}}
{"type":"config","name":"Optimize pitch randomization performance","metricName":"pitch_randomization_µs","metricUnit":"µs","bestDirection":"lower"}
{"run":15,"commit":"baselin","metric":0.3626,"metrics":{},"status":"keep","description":"Baseline pitch randomization: 0.36 µs per call. Float.random(in:) is highly optimized and NOT a bottleneck.","timestamp":1777733069871,"segment":8,"confidence":null,"asi":{"hypothesis":"Float.random(in:) might be slow enough to contribute to 10ms latency spikes","result":"Not a bottleneck","baseline_µs":"0.3626","note":"0.36 µs is negligible compared to audio pipeline latency (~430 µs). Random number generation is highly optimized in Swift.","files_tested":["KeyPulse/Tests/KeyPulseTests/PitchRandomizationPerformanceTest.swift"],"conclusion":"No optimization needed - already fast"}}
{"type":"config","name":"Optimize SettingsStore singleton test isolation","metricName":"test_execution_ms","metricUnit":"ms","bestDirection":"lower"}
{"run":16,"commit":"baselin","metric":0.434,"metrics":{"max_execution_ms":1.287,"min_execution_ms":0.401},"status":"keep","description":"Baseline SettingsStore test execution: 0.43 ms avg (0.40-1.29 ms range). Singleton-based isolation is NOT a performance bottleneck.","timestamp":1777733100368,"segment":9,"confidence":null,"asi":{"hypothesis":"SettingsStore singleton causes test state pollution and slow execution","result":"Not a bottleneck","baseline_ms":"0.434","note":"0.43 ms per test is very fast. UserDefaults operations are lightweight. The CONCERNS.md warning about 'test state pollution' is about correctness risk, not performance.","files_tested":["KeyPulse/Tests/KeyPulseTests/SettingsStoreTestExecutionTest.swift"],"conclusion":"No optimization needed - already fast"}}
{"type":"config","name":"Measure print() logging overhead in hot path","metricName":"print_overhead_µs","metricUnit":"µs","bestDirection":"lower"}
{"run":17,"commit":"baselin","metric":0.5294,"metrics":{"total_print_statements":20},"status":"keep","description":"Baseline print() overhead: 0.53 µs per call. Negligible in practice - print() is only called during state changes, not keystroke hot path.","timestamp":1777733127964,"segment":10,"confidence":null,"asi":{"hypothesis":"print() statements may add measurable overhead in hot paths","result":"Not a bottleneck in practice","baseline_µs":"0.5294","note":"0.53 µs is negligible. print() is only called during state changes (start/stop, profile load), not during every keystroke. CONCERNS.md recommendation to use os.Logger is about code quality and production readiness, not performance.","files_tested":["KeyPulse/Tests/KeyPulseTests/PrintOverheadPerformanceTest.swift"],"print_statements":["KeyPulseAppDelegate.swift (14)","KeyboardMonitor.swift (4)","AudioEngine.swift (1)","SettingsStore.swift (2)","MenuBarManager.swift (1)"],"conclusion":"No performance optimization needed - print() is already fast and not in hot path"}}
{"type":"config","name":"Measure total test suite execution time","metricName":"total_test_time_s","metricUnit":"s","bestDirection":"lower"}
{"run":18,"commit":"fdd35f2","metric":5.947,"metrics":{"tests_count":80,"tests_per_second":13.45},"status":"keep","description":"Total test suite execution: 80 tests in 5.95 seconds (~75 ms per test). Well-optimized test suite.","timestamp":1777733161065,"segment":11,"confidence":null,"asi":{"hypothesis":"Test suite execution time could be optimized","result":"Already well-optimized","baseline_s":"5.947","tests_count":80,"avg_ms_per_test":"74.3","note":"80 tests in ~6 seconds is efficient. Most tests use lightweight components or singletons with fast UserDefaults.","key_optimizations_already_applied":["Pre-warmed profiles eliminate file I/O during tests","Cached SMAppService.status eliminates IPC delays","os_unfair_lock reduces contention overhead"],"files_tested":["Full test suite - 80 tests"],"conclusion":"No further optimization needed - test suite is already fast"}}
{"run":19,"commit":"033aa5b","metric":6.949,"metrics":{"tests_count":87,"tests_per_second":12.52},"status":"keep","description":"Fix DiagnosticsData.== to compare all 22 fields + comprehensive tests. The partial Equatable (6/22 fields) was silently suppressing @Published emissions, causing the Debug Window to show stale data for latency, volume, mute, modifier flags, and other fields. Added 7 targeted tests covering keystroke, profile, latency, modifier, settings, and app info field groups.","timestamp":1777774756483,"segment":11,"confidence":null,"asi":{"hypothesis":"Partial Equatable in DiagnosticsData silently suppresses @Published UI updates for non-compared fields","result":"Confirmed bug. Fixed by comparing all 22 fields in ==.","fix":"Expanded == from 6 to 22 field comparisons","tests_added":7,"total_tests":87,"test_time_s":6.949,"files_changed":["DiagnosticsData.swift","KeyPulseTests.swift"]}}
{"type":"config","name":"Optimize @Published diagnosticsData overhead in keystroke hot path","metricName":"diagnostics_update_µs","metricUnit":"µs","bestDirection":"lower"}
{"run":20,"commit":"2b0a15a","metric":30.79,"metrics":{"tests_count":90,"tests_per_second":12.91,"throttle_guard_ns":112.7},"status":"keep","description":"Add source-level throttle (20 Hz) to diagnostics publish in keystroke hot path. Throttle guard overhead: 113 ns (negligible). Savings per skipped update: ~31 µs. At 60 keystrokes/sec, skips ~40 updates/sec saving ~1,240 µs/sec of main-thread work.","timestamp":1777775265237,"segment":12,"confidence":null,"asi":{"hypothesis":"@Published diagnosticsData fires on every keystroke, wasting Combine pipeline work since DebugWindowController throttles to 10 Hz","result":"Added source-level throttle at 20 Hz in setupKeyboardHandler(). On fast typing (60 keys/sec), ~90% of updateDiagnosticsData() calls are skipped.","baseline_µs":31.58,"optimized_µs":30.79,"per_call_improvement":"within noise (unchanged, as expected — optimization reduces call frequency, not per-call cost)","throttle_guard_ns":112.7,"savings_per_skipped_update_µs":"~31","savings_at_60_kps":"~1,240 µs/sec of main-thread overhead eliminated","throttle_rate_hz":20,"mechanism":"CFAbsoluteTimeGetCurrent() guard with 50ms interval before calling updateDiagnosticsData()","manual_bypasses":["settings changes (setVolume, setMuted, etc.)","resetStats()","diagnostics() public API"],"files_changed":["KeyPulseController.swift","DiagnosticsUpdatePerformanceTest.swift"]}}
{"type":"config","name":"Optimize keyCodeDisplayName switch with dictionary lookup","metricName":"keycode_lookup_ns","metricUnit":"ns","bestDirection":"lower"}
{"run":21,"commit":"38295e7","metric":72.6,"metrics":{"switch_lookup_ns":72.6,"dict_hit_ns":80.9,"dict_miss_ns":126.7},"status":"keep","description":"Baseline keyCodeDisplayName switch: 72.6 ns per lookup. Dictionary lookup is slower (80.9 ns hits, 126.7 ns misses). Swift switch compiles to efficient integer jump table — already optimal. Overhead at 20 Hz throttle: ~1.45 µs/sec (negligible).","timestamp":1777775434622,"segment":13,"confidence":null,"asi":{"hypothesis":"Dictionary lookup might be faster than 60-case switch for sparse key codes","result":"Switch is faster. Swift compiles integer switches into jump tables — more efficient than dictionary hashing + optional unwrapping.","baseline_ns":72.6,"dict_hit_ns":80.9,"dict_miss_ns":126.7,"verdict":"Current implementation is optimal. No change needed.","note":"At 20 Hz throttle rate, total overhead is ~1.45 µs/sec — completely negligible"}}
{"type":"config","name":"Measure AVAudioConverter overhead in buffer loading","metricName":"buffer_convert_µs","metricUnit":"µs","bestDirection":"lower"}
{"run":22,"commit":"475e66b","metric":99.14,"metrics":{"wav_read_µs":11.47,"format_convert_µs":10.11,"convert_percent":46.9,"full_engine_per_sample_µs":99.14,"prewarm_cache_hit_µs":4.69},"status":"keep","description":"Measured AVAudioConverter overhead: 10.1 µs per sample (47% of load+convert). WAVs are mono 44.1kHz, engine wants stereo 44.1kHz deinterleaved — conversion unavoidable. Pre-warming already eliminates this from hot path (0ms switch). Pre-encoding WAVs to stereo would save ~120 µs total — not worth format fragility.","timestamp":1777775793145,"segment":14,"confidence":null,"asi":{"hypothesis":"AVAudioConverter overhead during buffer loading could be eliminated by pre-encoding WAVs to engine format","result":"Conversion is 10.1 µs per sample (47% of load+convert). Pre-encoding would save ~120 µs total per pre-warm but adds build complexity and risks format mismatch across hardware (sample rate, interleaving varies). Pre-warming already eliminates this from the hot path — 0ms profile switches after initial load.","source_format":"1 ch, 44100 Hz, Float32 (mono)","engine_format":"2 ch, 44100 Hz, Float32, deinterleaved (stereo)","verdict":"Not worth optimizing — pre-warming is the correct solution"}}
{"type":"config","name":"Eliminate force-unwraps for production crash safety","metricName":"force_unwrap_count","metricUnit":"count","bestDirection":"lower"}
{"run":23,"commit":"aba5c7f","metric":0,"metrics":{"tests_count":91,"tests_per_second":11.14,"boolean_negations_remaining":8},"status":"keep","description":"Eliminated all 5 force-unwraps for production crash safety. MenuBarManager: replaced 4 implicitly-unwrapped menu item references with local let variables. KeyboardMonitor: URL(string:) force-unwrap replaced with guard let. All 91 tests pass. Remaining 8 '!' are boolean negation (safe).","timestamp":1777775917386,"segment":15,"confidence":null,"asi":{"hypothesis":"Force-unwraps in production code are crash risks that should be eliminated","baseline_count":5,"optimized_count":0,"eliminated":5,"files_changed":["MenuBarManager.swift","KeyboardMonitor.swift"],"technique":["Menu items: local let variables instead of IUO + force-unwrap","URL: guard let with early return + log message"],"test_result":"All 91 tests pass","priority":"High — reviewer-flagged blocking issue"}}
{"type":"config","name":"Add CGEventTap restart on system wake for production resilience","metricName":"sleep_resilience","metricUnit":"","bestDirection":"higher"}
